root@nahkos-COMP3134-47984:~# tcpdump -n -i eth0
tcpdump: verbose output suppressed, use -v or -vv for full protocol decode
listening on eth0, link-type EN10MB (Ethernet), capture size 262144 bytes
23:53:34.736817 IP 134.122.35.20.22 > 216.154.16.220.60119: Flags [P.], seq 1337721511:1337721699, ack 2055624804, win 501, length 188
23:53:34.772386 IP 216.154.16.220.60119 > 134.122.35.20.22: Flags [.], ack 0, win 507, length 0
23:53:34.772462 IP 134.122.35.20.22 > 216.154.16.220.60119: Flags [P.], seq 188:360, ack 1, win 501, length 172
23:53:34.772714 IP 134.122.35.20.22 > 216.154.16.220.60119: Flags [P.], seq 360:604, ack 1, win 501, length 244
23:53:34.820615 IP 216.154.16.220.60119 > 134.122.35.20.22: Flags [.], ack 0, win 507, options [nop,nop,sack 1 {188:360}], length 0
23:53:34.820687 IP 134.122.35.20.22 > 216.154.16.220.60119: Flags [P.], seq 0:188, ack 1, win 501, length 188
23:53:34.821261 IP 216.154.16.220.60119 > 134.122.35.20.22: Flags [.], ack 0, win 507, options [nop,nop,sack 1 {188:604}], length 0
23:53:34.821303 IP 134.122.35.20.22 > 216.154.16.220.60119: Flags [P.], seq 604:1036, ack 1, win 501, length 432
23:53:34.868392 IP 216.154.16.220.60119 > 134.122.35.20.22: Flags [.], ack 604, win 513, length 0
23:53:34.868466 IP 134.122.35.20.22 > 216.154.16.220.60119: Flags [P.], seq 1036:1320, ack 1, win 501, length 284
23:53:34.912036 IP 216.154.16.220.60119 > 134.122.35.20.22: Flags [.], ack 1320, win 510, length 0
23:53:34.912109 IP 134.122.35.20.22 > 216.154.16.220.60119: Flags [P.], seq 1320:1572, ack 1, win 501, length 252
23:53:34.912321 IP 134.122.35.20.22 > 216.154.16.220.60119: Flags [P.], seq 1572:1824, ack 1, win 501, length 252
23:53:34.912510 IP 134.122.35.20.22 > 216.154.16.220.60119: Flags [P.], seq 1824:1980, ack 1, win 501, length 156
23:53:34.953491 IP 216.154.16.220.60119 > 134.122.35.20.22: Flags [.], ack 1980, win 507, length 0
23:53:34.953571 IP 134.122.35.20.22 > 216.154.16.220.60119: Flags [P.], seq 1980:2136, ack 1, win 501, length 156
23:53:34.953789 IP 134.122.35.20.22 > 216.154.16.220.60119: Flags [P.], seq 2136:2388, ack 1, win 501, length 252
23:53:34.954028 IP 134.122.35.20.22 > 216.154.16.220.60119: Flags [P.], seq 2388:2544, ack 1, win 501, length 156
23:53:35.001739 IP 216.154.16.220.60119 > 134.122.35.20.22: Flags [.], ack 2136, win 513, length 0
23:53:35.001821 IP 134.122.35.20.22 > 216.154.16.220.60119: Flags [P.], seq 2544:2700, ack 1, win 501, length 156
23:53:35.003059 IP 216.154.16.220.60119 > 134.122.35.20.22: Flags [.], ack 2544, win 511, length 0
23:53:35.003125 IP 134.122.35.20.22 > 216.154.16.220.60119: Flags [P.], seq 2700:2952, ack 1, win 501, length 252
23:53:35.003273 IP 134.122.35.20.22 > 216.154.16.220.60119: Flags [P.], seq 2952:3204, ack 1, win 501, length 252
23:53:35.029117 IP 216.154.16.220.60119 > 134.122.35.20.22: Flags [.], ack 3204, win 509, length 0
23:53:35.029201 IP 134.122.35.20.22 > 216.154.16.220.60119: Flags [P.], seq 3204:3360, ack 1, win 501, length 156
23:53:35.029418 IP 134.122.35.20.22 > 216.154.16.220.60119: Flags [P.], seq 3360:3612, ack 1, win 501, length 252
23:53:35.029516 IP 134.122.35.20.22 > 216.154.16.220.60119: Flags [P.], seq 3612:3768, ack 1, win 501, length 156
23:53:35.057898 IP 216.154.16.220.60119 > 134.122.35.20.22: Flags [.], ack 3768, win 513, length 0
23:53:35.057960 IP 134.122.35.20.22 > 216.154.16.220.60119: Flags [P.], seq 3768:3924, ack 1, win 501, length 156
23:53:35.058174 IP 134.122.35.20.22 > 216.154.16.220.60119: Flags [P.], seq 3924:4176, ack 1, win 501, length 252
23:53:35.058268 IP 134.122.35.20.22 > 216.154.16.220.60119: Flags [P.], seq 4176:4332, ack 1, win 501, length 156
23:53:35.058353 IP 134.122.35.20.22 > 216.154.16.220.60119: Flags [P.], seq 4332:4488, ack 1, win 501, length 156
23:53:35.058431 IP 134.122.35.20.22 > 216.154.16.220.60119: Flags [P.], seq 4488:4644, ack 1, win 501, length 156
23:53:35.089574 IP 216.154.16.220.60119 > 134.122.35.20.22: Flags [.], ack 4176, win 511, length 0
23:53:35.089574 IP 216.154.16.220.60119 > 134.122.35.20.22: Flags [.], ack 4644, win 509, length 0
23:53:35.089652 IP 134.122.35.20.22 > 216.154.16.220.60119: Flags [P.], seq 4644:4800, ack 1, win 501, length 156
23:53:35.089878 IP 134.122.35.20.22 > 216.154.16.220.60119: Flags [P.], seq 4800:5156, ack 1, win 501, length 356
23:53:35.090080 IP 134.122.35.20.22 > 216.154.16.220.60119: Flags [P.], seq 5156:5312, ack 1, win 501, length 156
23:53:35.090181 IP 134.122.35.20.22 > 216.154.16.220.60119: Flags [P.], seq 5312:5468, ack 1, win 501, length 156
23:53:35.090398 IP 134.122.35.20.22 > 216.154.16.220.60119: Flags [P.], seq 5468:5624, ack 1, win 501, length 156
23:53:35.133895 IP 216.154.16.220.60119 > 134.122.35.20.22: Flags [.], ack 5468, win 513, length 0
23:53:35.133973 IP 134.122.35.20.22 > 216.154.16.220.60119: Flags [P.], seq 5624:5780, ack 1, win 501, length 156
23:53:35.134203 IP 134.122.35.20.22 > 216.154.16.220.60119: Flags [P.], seq 5780:6032, ack 1, win 501, length 252
23:53:35.134365 IP 134.122.35.20.22 > 216.154.16.220.60119: Flags [P.], seq 6032:6188, ack 1, win 501, length 156
23:53:35.134517 IP 134.122.35.20.22 > 216.154.16.220.60119: Flags [P.], seq 6188:6344, ack 1, win 501, length 156
23:53:35.178189 IP 216.154.16.220.60119 > 134.122.35.20.22: Flags [.], ack 5624, win 512, length 0
23:53:35.178271 IP 134.122.35.20.22 > 216.154.16.220.60119: Flags [P.], seq 6344:6500, ack 1, win 501, length 156
23:53:35.180714 IP 216.154.16.220.60119 > 134.122.35.20.22: Flags [.], ack 6344, win 509, length 0
23:53:35.180770 IP 134.122.35.20.22 > 216.154.16.220.60119: Flags [P.], seq 6500:6752, ack 1, win 501, length 252
23:53:35.180919 IP 134.122.35.20.22 > 216.154.16.220.60119: Flags [P.], seq 6752:7004, ack 1, win 501, length 252
23:53:35.181041 IP 134.122.35.20.22 > 216.154.16.220.60119: Flags [P.], seq 7004:7160, ack 1, win 501, length 156
23:53:35.181169 IP 134.122.35.20.22 > 216.154.16.220.60119: Flags [P.], seq 7160:7316, ack 1, win 501, length 156
23:53:35.227069 IP 216.154.16.220.60119 > 134.122.35.20.22: Flags [.], ack 6752, win 508, length 0
